id,name,type,type_damage,pp,power,description,name_corrected
216,return,Normal, Physical,20,0,This move can’t be used.It’s recommended that this move is forgotten. Once forgotten  this move can’t be remembered,return
217,present,Normal, Physical,15,0,The user attacks by giving the target a gift with a hidden trap. The gift restores HP sometimes  however.,present
218,frustration,Normal, Physical,20,0,This move can’t be used.It’s recommended that this move is forgotten. Once forgotten  this move can’t be remembered,frustration
219,safeguard,Normal, Status,25,0,The user creates a protective field that prevents status conditions for five turns.,safeguard
220,pain split,Normal, Status,20,0,The user adds its HP to the target's HP  then equally splits the combined HP between the target and itself.,pain-split
221,sacred fire,Fire, Physical,5,100,The target is razed with a mystical fire of great intensity. This may also leave the target with a burn.,sacred-fire
222,magnitude,Ground, Physical,30,0,This move can’t be used.It’s recommended that this move is forgotten. Once forgotten  this move can’t be remembered,magnitude
223,dynamic punch,Fighting, Physical,5,100,The user attacks by punching the target with full concentrated power. This also confuses the target.,dynamic-punch
224,megahorn,Bug, Physical,10,120,Using its tough and impressive horn  the user rams into the target with no letup.,megahorn
225,dragon breath,Dragon, Special,20,60,The user exhales a mighty gust that inflicts damage. This may also leave the target with paralysis.,dragon-breath
226,baton pass,Normal, Status,40,0,The user switches places with a party Pokémon in waiting and passes along any stat changes.,baton-pass
227,encore,Normal, Status,5,0,The user compels the target to keep using the move it encored for three turns.,encore
228,pursuit,Dark, Physical,20,40,This move can’t be used.It’s recommended that this move is forgotten. Once forgotten  this move can’t be remembered,pursuit
229,rapid spin,Normal, Physical,40,50,The user performs a spin attack that can also eliminate the effects of such moves as Bind  Wrap  and Leech Seed. This also boosts the user's Speed stat.,rapid-spin
230,sweet scent,Normal, Status,20,0,The user releases a scent that harshly lowers opposing Pokémon's evasiveness.,sweet-scent
231,iron tail,Steel, Physical,15,100,The target is slammed with a steel-hard tail. This may also lower the target's Defense stat.,iron-tail
232,metal claw,Steel, Physical,35,50,The target is raked with steel claws. This may also boost the user's Attack stat.,metal-claw
233,vital throw,Fighting, Physical,10,70,The user attacks last. In return  this throw movenever misses.,vital-throw
234,morning sun,Normal, Status,5,0,The user restores its own HP. The amount of HP regained varies with the weather.,morning-sun
235,synthesis,Grass, Status,5,0,The user restores its own HP. The amount of HP regained varies with the weather.,synthesis
236,moonlight,Fairy, Status,5,0,The user restores its own HP. The amount of HP regained varies with the weather.,moonlight
237,hidden power,Normal, Special,15,60,This move can’t be used.It’s recommended that this move is forgotten. Once forgotten  this move can’t be remembered,hidden-power
238,cross chop,Fighting, Physical,5,100,The user delivers a double chop with its forearms crossed. This move has a heightened chance of landing a critical hit.,cross-chop
239,twister,Dragon, Special,20,40,The user whips up a vicious tornado to tear at opposing Pokémon. This may also make them flinch.,twister
240,rain dance,Water, Status,5,0,The user summons a heavy rain that falls for five turns  powering up Water-type attacks. The rain also lowers the power of Fire-type attacks.,rain-dance
241,sunny day,Fire, Status,5,0,The user intensifies the sun for five turns  powering up Fire-type attacks. The sunlight also lowers the power of Water-type attacks.,sunny-day
242,crunch,Dark, Physical,15,80,The user crunches up the target with sharp fangs. This may also lower the target's Defense stat.,crunch
243,mirror coat,Psychic, Special,20,0,A retaliatory attack that counters any special move  inflicting double the damage taken.,mirror-coat
244,psych up,Normal, Status,10,0,The user hypnotizes itself into copying any stat change made by the target.,psych-up
245,extreme speed,Normal, Physical,5,80,The user charges the target at blinding speed. This move always goes first.,extreme-speed
246,ancient power,Rock, Special,5,60,The user attacks with a prehistoric power. This may also boost all the user's stats at once.,ancient-power
247,shadow ball,Ghost, Special,15,80,The user attacks by hurling a shadowy blob at the target. This may also lower the target’s Sp. Def stat.,shadow-ball
248,future sight,Psychic, Special,10,120,Two turns after this move is used  a hunk of psychic energy attacks the target.,future-sight
249,rock smash,Fighting, Physical,15,40,The user attacks with a punch. This may also lower the target's Defense stat.,rock-smash
250,whirlpool,Water, Special,15,35,The user traps the target inside a violent  swirling whirlpool that inflicts damage for four to five turns.,whirlpool
251,beat up,Dark, Physical,10,0,The user gets all party Pokémon to attack the target. The more party Pokémon  the greater the number of attacks.,beat-up
252,fake out,Normal, Physical,10,40,This attack hits first and makes the target flinch. It works only on the first turn each time the user enters battle.,fake-out
253,uproar,Normal, Special,10,90,The user attacks in an uproar for three turns. During that time  no Pokémon can fall asleep.,uproar
254,stockpile,Normal, Status,20,0,The user stores power and boosts its Defense and Sp. Def stats. This move can be used up to three times.,stockpile
255,spit up,Normal, Special,10,0,The power stored using the move Stockpile is released at once in an attack. The more power is stored  the greater the move's power.,spit-up
256,swallow,Normal, Status,10,0,The power stored using the move Stockpile is absorbed by the user to restore its own HP. The more power is stored  the more HP is restored.,swallow
257,heat wave,Fire, Special,10,95,The user attacks by exhaling hot breath on opposing Pokémon. This may also leave them with a burn.,heat-wave
258,hail,Ice, Status,10,0,The user summons a hailstorm lasting five turns.It damages all Pokémon except Ice types.,hail
259,torment,Dark, Status,15,0,The user torments and enrages the target  making it incapable of using the same move twice in a row.,torment
260,flatter,Dark, Status,15,0,Flattery is used to confuse the target. However  this also boosts the target's Sp. Atk stat.,flatter
261,will-o-wisp,Fire, Status,15,0,The user shoots a sinister flame at the target to inflict a burn.,will-o-wisp
262,memento,Dark, Status,10,0,The user faints. In return  the target's Attack and Sp. Atk stats are harshly lowered.,memento
263,facade,Normal, Physical,20,70,This move's power is doubled if the user is poisoned  burned  or paralyzed.,facade
264,focus punch,Fighting, Physical,20,150,The user focuses its mind before launching a punch. This move fails if the user is hit before using the move.,focus-punch
265,smelling salts,Normal, Physical,10,70,This move can’t be used.It’s recommended that this move is forgotten. Once forgotten  this move can’t be remembered,smelling-salts
266,follow me,Normal, Status,20,0,The user draws attention to itself  making all opposing Pokémon take aim only at the user.,follow-me
267,nature power,Normal, Status,20,0,This attack makes use of nature’s power. Itseffects vary depending on the user’s environment.,nature-power
268,charge,Electric, Status,20,0,The user becomes charged  boosting the power of the next Electric-type move it uses. This also boosts the user's Sp. Def stat.,charge
269,taunt,Dark, Status,20,0,The target is taunted into a rage that allows it to use only attack moves for three turns.,taunt
270,helping hand,Normal, Status,20,0,The user assists an ally by boosting the power of that ally's attack.,helping-hand
271,trick,Psychic, Status,10,0,The user catches the target off guard and swaps the target's held item with its own.,trick
272,role play,Psychic, Status,10,0,The user mimics the target completely  copying the target's Ability.,role-play
273,wish,Normal, Status,10,0,One turn after this move is used  the user's or its replacement's HP is restored by up to half the user's max HP.,wish
274,assist,Normal, Status,20,0,This move can’t be used.It’s recommended that this move is forgotten. Once forgotten  this move can’t be remembered,assist
275,ingrain,Grass, Status,20,0,The user lays roots that restore its own HP every turn. Because the user is now rooted  it can't switch out.,ingrain
276,superpower,Fighting, Physical,5,120,The user attacks the target with great power. This also lowers the user's Attack and Defense stats.,superpower
277,magic coat,Psychic, Status,15,0,Moves like Leech Seed and moves that inflict statusconditions are blocked by a barrier and reflected backto the user of those moves.,magic-coat
278,recycle,Normal, Status,10,0,The user recycles a held item that has been used in battle so it can be used again.,recycle
279,revenge,Fighting, Physical,10,60,This attack move’s power is doubled if the user hasbeen hurt by the opponent in the same turn.,revenge
280,brick break,Fighting, Physical,15,75,The user attacks with a swift chop. This move can also break barriers  such as Light Screen and Reflect.,brick-break
281,yawn,Normal, Status,10,0,The user lets loose a huge yawn that lulls the target into falling asleep on the next turn.,yawn
282,knock off,Dark, Physical,20,65,The user slaps down the target's held item  making it unusable for that battle. This move does more damage if the target has a held item.,knock-off
283,endeaor,Normal, Physical,5,0,The user inflicts damage by cutting down the target's HP to roughly equal the user's HP.,endeaor
284,eruption,Fire, Special,5,150,The user attacks opposing Pokémon with explosive fury. The lower the user's HP  the lower the move's power.,eruption
285,skill swap,Psychic, Status,10,0,The user employs its psychic power to exchange Abilities with the target.,skill-swap
286,imprison,Psychic, Status,10,0,If opposing Pokémon know any move also known by the user  they are prevented from using it.,imprison
287,refresh,Normal, Status,20,0,This move can’t be used.It’s recommended that this move is forgotten. Once forgotten  this move can’t be remembered,refresh
288,grudge,Ghost, Status,5,0,If the user faints  the user’s grudge fully depletesthe PP of the opponent’s move that knocked it out.,grudge
289,snatch,Dark, Status,10,0,This move can’t be used.It’s recommended that this move is forgotten. Once forgotten  this move can’t be remembered,snatch
290,secret power,Normal, Physical,20,70,This move can’t be used.It’s recommended that this move is forgotten. Once forgotten  this move can’t be remembered,secret-power
291,dive,Water, Physical,10,80,The user dives on the first turn  then floats up and attacks on the next turn.,dive
292,arm thrust,Fighting, Physical,20,15,The user attacks the target with open-palmed arm thrusts. This move hits two to five times in a row.,arm-thrust
293,camouflage,Normal, Status,20,0,This move can’t be used.It’s recommended that this move is forgotten. Once forgotten  this move can’t be remembered,camouflage
294,tail glow,Bug, Status,20,0,This move can't be used. It's recommended that this move is forgotten. Once forgotten  this move can't be remembered.,tail-glow
295,luster purge,Psychic, Special,5,70,The user lets loose a damaging burst of light. This may also lower the target's Sp. Def stat.,luster-purge
296,mist ball,Psychic, Special,5,70,A mist-like flurry of down envelops and damages the target. This may also lower the target's Sp. Atk stat.,mist-ball
297,feather dance,Flying, Status,15,0,The user covers the target's body with a mass of down that harshly lowers its Attack stat.,feather-dance
298,teeter dance,Normal, Status,20,0,The user performs a wobbly dance that confuses every Pokémon around it.,teeter-dance
299,blaze kick,Fire, Physical,10,85,The user launches a kick that has a heightened chance of landing a critical hit. This may also leave the target with a burn.,blaze-kick
300,mud sport,Ground, Status,15,0,This move can’t be used.It’s recommended that this move is forgotten. Once forgotten  this move can’t be remembered,mud-sport
301,ice ball,Ice, Physical,20,30,This move can’t be used.It’s recommended that this move is forgotten. Once forgotten  this move can’t be remembered,ice-ball
302,needle arm,Grass, Physical,15,60,This move can’t be used.It’s recommended that this move is forgotten. Once forgotten  this move can’t be remembered,needle-arm
303,slack off,Normal, Status,10,0,The user slacks off  restoring its own HP by up to half its max HP.,slack-off
304,hyper oice,Normal, Special,10,90,The user attacks by letting loose a horribly loud  resounding cry.,hyper-oice
305,poison fang,Poison, Physical,15,50,The user bites the target with toxic fangs. This may also leave the target badly poisoned.,poison-fang
306,crush claw,Normal, Physical,10,75,The user slashes the target with hard and sharp claws. This may also lower the target's Defense stat.,crush-claw
307,blast burn,Fire, Special,5,150,The target is razed by a fiery explosion. The user can't move on the next turn.,blast-burn
308,hydro cannon,Water, Special,5,150,The target is hit with a watery blast. The user can't move on the next turn.,hydro-cannon
309,meteor mash,Steel, Physical,10,90,The target is hit with a hard punch fired like a meteor. This may also boost the user’s Attack stat.,meteor-mash
310,astonish,Ghost, Physical,15,30,The user attacks the target by crying out in a startling fashion. This may also make the target flinch.,astonish
311,weather ball,Normal, Special,10,50,This move's type and power change depending on the weather at the time the move is used.,weather-ball
312,aromatherapy,Grass, Status,5,0,This move can't be used. It's recommended that this move is forgotten. Once forgotten  this move can't be remembered.,aromatherapy
313,fake tears,Dark, Status,20,0,The user feigns crying to fluster the target. This harshly lowers the target's Sp. Def stat.,fake-tears
314,air cutter,Flying, Special,25,60,The user launches razor-like wind to slash opposing Pokémon. This move has a heightened chance of landing a critical hit.,air-cutter
315,overheat,Fire, Special,5,130,The user attacks the target with all its might. The recoil from this move harshly lowers the user's Sp. Atk stat.,overheat
316,odor sleuth,Normal, Status,40,0,This move can’t be used.It’s recommended that this move is forgotten. Once forgotten  this move can’t be remembered,odor-sleuth
317,rock tomb,Rock, Physical,15,60,The user hurls boulders at the target to inflict damage. This also lowers the target's Speed stat by cutting off its movement.,rock-tomb
318,silver wind,Bug, Special,5,60,This move can’t be used.It’s recommended that this move is forgotten. Once forgotten  this move can’t be remembered,silver-wind
319,metal sound,Steel, Status,40,0,A horrible sound like scraping metal harshly lowers the target's Sp. Def stat.,metal-sound
320,grass whistle,Grass, Status,15,0,This move can’t be used.It’s recommended that this move is forgotten. Once forgotten  this move can’t be remembered,grass-whistle
321,tickle,Normal, Status,20,0,The user tickles the target into laughing  lowering its Attack and Defense stats.,tickle
322,cosmic power,Psychic, Status,20,0,The user absorbs a mystical power from space to boost its Defense and Sp. Def stats.,cosmic-power
323,water spout,Water, Special,5,150,The user spouts water to damage opposing Pokémon. The lower the user's HP  the lower the move's power.,water-spout
324,signal beam,Bug, Special,15,75,This move can’t be used.It’s recommended that this move is forgotten. Once forgotten  this move can’t be remembered,signal-beam
325,shadow punch,Ghost, Physical,20,60,The user throws a punch from the shadows. This attack never misses.,shadow-punch
326,extrasensory,Psychic, Special,20,80,The user attacks with an odd  unseeable power. This may also make the target flinch.,extrasensory
327,sky uppercut,Fighting, Physical,15,85,This move can’t be used.It’s recommended that this move is forgotten. Once forgotten  this move can’t be remembered,sky-uppercut
328,sand tomb,Ground, Physical,15,35,The user traps the target inside a harshly raging sandstorm that inflicts damage for four to five turns.,sand-tomb
329,sheer cold,Ice, Special,5,0,The target faints instantly. This move is less likely to hit the target if used by Pokémon other than Ice types.,sheer-cold
330,muddy water,Water, Special,10,90,The user attacks by shooting muddy water at opposing Pokémon. This may also lower their accuracy.,muddy-water
331,bullet seed,Grass, Physical,30,25,The user attacks by forcefully shooting seeds at the target. This move hits two to five times in a row.,bullet-seed
332,aerial ace,Flying, Physical,20,60,The user confounds the target with speed  then slashes. This attack never misses.,aerial-ace
333,icicle spear,Ice, Physical,30,25,The user attacks by launching sharp icicles at the target. This move hits two to five times in a row.,icicle-spear
334,iron defense,Steel, Status,15,0,The user hardens its body's surface like iron  sharply boosting its Defense stat.,iron-defense
335,block,Normal, Status,5,0,The user blocks the target's way with arms spread wide to prevent the target from fleeing.,block
336,howl,Normal, Status,40,0,The user howls loudly to rouse itself and its allies. This boosts their Attack stats.,howl
337,dragon claw,Dragon, Physical,15,80,The user slashes the target with huge  sharp claws to inflict damage.,dragon-claw
338,frenzy plant,Grass, Special,5,150,The user slams the target with the roots of an enormous tree. The user can't move on the next turn.,frenzy-plant
339,bulk up,Fighting, Status,20,0,The user tenses its muscles to bulk up its body  boosting its Attack and Defense stats.,bulk-up
340,bounce,Flying, Physical,5,85,The user bounces up high on the first turn  then drops onto the target on the next turn. This may also leave the target with paralysis.,bounce
341,mud shot,Ground, Special,15,55,The user attacks by hurling a blob of mud at the target. This also lowers the target's Speed stat.,mud-shot
342,poison tail,Poison, Physical,25,50,The user hits the target with its tail. This move has a heightened chance of landing a critical hit and may also poison the target.,poison-tail
343,coet,Normal, Physical,25,60,The user endearingly approaches the target  then steals the target's held item.,coet
344,volt tackle,Electric, Physical,15,120,The user electrifies itself and charges the target.This also damages the user quite a lot. This attackmay leave the target with paralysis.,volt-tackle
345,magical leaf,Grass, Special,20,60,The user scatters curious leaves that chase the target. This attack never misses.,magical-leaf
346,water sport,Water, Status,15,0,This move can’t be used.It’s recommended that this move is forgotten. Once forgotten  this move can’t be remembered,water-sport
347,calm mind,Psychic, Status,20,0,The user quietly focuses its mind and calms its spirit to boost its Sp. Atk and Sp. Def stats.,calm-mind
348,leaf blade,Grass, Physical,15,90,The user handles a sharp leaf like a sword and cuts the target to inflict damage. This move has a heightened chance of landing a critical hit.,leaf-blade
349,dragon dance,Dragon, Status,20,0,The user vigorously performs a mystic  powerful dance that boosts its Attack and Speed stats.,dragon-dance
350,rock blast,Rock, Physical,10,25,The user attacks by hurling hard rocks at the target. This move hits two to five times in a row.,rock-blast
351,shock wave,Electric, Special,20,60,The user strikes the target with a quick jolt of electricity. This attack never misses.,shock-wave
352,water pulse,Water, Special,20,60,The user attacks the target with a pulsing blast of water. This may also confuse the target.,water-pulse
353,doom desire,Steel, Special,5,140,This move can't be used. It's recommended that this move is forgotten. Once forgotten  this move can't be remembered.,doom-desire
354,psycho boost,Psychic, Special,5,140,The user attacks the target with all its might. The recoil from this move harshly lowers the user's Sp. Atk stat.,psycho-boost
355,roost,Flying, Status,10,0,The user lands and rests its body. This move restores the user's HP by up to half its max HP.,roost
356,graty,Psychic, Status,5,0,Enables Flying types or Pokémon with the Levitate Ability to be hit by Ground-type moves for five turns. Moves that involve flying can't be used.,graty
357,miracle eye,Psychic, Status,40,0,This move can’t be used.It’s recommended that this move is forgotten. Once forgotten  this move can’t be remembered,miracle-eye
358,wake-up slap,Fighting, Physical,10,70,This move can’t be used.It’s recommended that this move is forgotten. Once forgotten  this move can’t be remembered,wake-up-slap
359,hammer arm,Fighting, Physical,10,100,The user swings its strong  heavy fist at the target to inflict damage. This also lowers the user's Speed stat.,hammer-arm
360,gyro ball,Steel, Physical,5,0,The user tackles the target with a high-speed spin. The slower the user is than the target  the greater the move's power.,gyro-ball
361,healing wish,Psychic, Status,10,0,The user faints. In return  the Pokémon taking its place will have its HP restored and status conditions cured.,healing-wish
362,brine,Water, Special,10,65,This move's power is doubled if the target's HP is at half or less.,brine
363,natural gift,Normal, Physical,15,0,This move can’t be used.It’s recommended that this move is forgotten. Once forgotten  this move can’t be remembered,natural-gift
364,feint,Normal, Physical,10,30,This attack can hit a target using a move such as Protect or Detect. This also lifts the effects of those moves.,feint
365,pluck,Flying, Physical,20,60,The user attacks by pecking the target. If the target is holding a Berry  the user eats it and gains its effect.,pluck
366,tailwind,Flying, Status,15,0,The user whips up a turbulent whirlwind that boosts the Speed stats of itself and its allies for four turns.,tailwind
367,acupressure,Normal, Status,30,0,The user applies pressure to stress points  sharply boosting one of its or its allies' stats.,acupressure
368,metal burst,Steel, Physical,10,0,The user retaliates with much greater force against the opponent that last inflicted damage on it.,metal-burst
369,u-turn,Bug, Physical,20,70,After making its attack  the user rushes back to switch places with a party Pokémon in waiting.,u-turn
370,close combat,Fighting, Physical,5,120,The user fights the target up close  inflicting damage without guarding itself. This also lowers the user's Defense and Sp. Def stats.,close-combat
371,payback,Dark, Physical,10,50,The user stores power  then attacks. This move's power is doubled if the user moves after the target.,payback
372,assurance,Dark, Physical,10,60,This move's power is doubled if the target has already taken some damage in the same turn.,assurance
373,embargo,Dark, Status,15,0,This move can’t be used.It’s recommended that this move is forgotten. Once forgotten  this move can’t be remembered,embargo
374,fling,Dark, Physical,10,0,The user flings its held item at the target to attack. This move's power and effects depend on the item.,fling
375,psycho shift,Psychic, Status,10,0,Using its psychic power of suggestion  the usertransfers its status conditions to the target.,psycho-shift
376,trump card,Normal, Special,5,0,This move can’t be used.It’s recommended that this move is forgotten. Once forgotten  this move can’t be remembered,trump-card
377,heal block,Psychic, Status,15,0,This move can’t be used.It’s recommended that this move is forgotten. Once forgotten  this move can’t be remembered,heal-block
378,wring out,Normal, Special,5,0,This move can’t be used.It’s recommended that this move is forgotten. Once forgotten  this move can’t be remembered,wring-out
379,power trick,Psychic, Status,10,0,The user employs its psychic power to switch itsAttack stat with its Defense stat.,power-trick
380,gastro acid,Poison, Status,10,0,The user hurls up its stomach acids on the target. The fluid eliminates the effect of the target's Ability.,gastro-acid
381,lucky chant,Normal, Status,30,0,This move can’t be used.It’s recommended that this move is forgotten. Once forgotten  this move can’t be remembered,lucky-chant
382,me first,Normal, Status,20,0,This move can’t be used.It’s recommended that this move is forgotten. Once forgotten  this move can’t be remembered,me-first
383,copycat,Normal, Status,20,0,The user mimics the move used immediately before it. The move fails if no other move has been used yet.,copycat
384,power swap,Psychic, Status,10,0,The user employs its psychic power to switch changes to its Attack and Sp. Atk stats with the target.,power-swap
385,guard swap,Psychic, Status,10,0,The user employs its psychic power to switch changes to its Defense and Sp. Def stats with the target.,guard-swap
386,punishment,Dark, Physical,5,0,This move can’t be used.It’s recommended that this move is forgotten. Once forgotten  this move can’t be remembered,punishment
387,last resort,Normal, Physical,5,140,This move can be used only after the user has used all the other moves it knows in the battle.,last-resort
388,worry seed,Grass, Status,10,0,A seed that causes worry is planted on the target. It prevents sleep by making the target's Ability Insomnia.,worry-seed
389,sucker punch,Dark, Physical,5,70,This move enables the user to attack first. This move fails if the target is not readying an attack.,sucker-punch
