id,name,type,type_damage,pp,power,description,name_corrected
390,toxic spikes,Poison, Status,20,0,The user lays a trap of poison spikes at the feet of the opposing team. The spikes will poison opposing Pokémon that switch into battle.,toxic-spikes
391,heart swap,Psychic, Status,10,0,The user employs its psychic power to switch stat changes with the target.,heart-swap
392,aqua ring,Water, Status,20,0,The user envelops itself in a veil made of water. It regains some HP every turn.,aqua-ring
393,magnet rise,Electric, Status,10,0,The user levitates using electrically generated magnetism for five turns.,magnet-rise
394,flare blitz,Fire, Physical,15,120,The user cloaks itself in fire and charges the target to inflict damage. This also damages the user quite a lot and may leave the target with a burn.,flare-blitz
395,force palm,Fighting, Physical,10,60,The target is attacked with a shock wave. This may also leave the target with paralysis.,force-palm
396,aura sphere,Fighting, Special,20,80,The user lets loose a pulse of aura power from deep within its body at the target. This attack never misses.,aura-sphere
397,rock polish,Rock, Status,20,0,The user polishes its body to reduce drag. This sharply boosts the user's Speed stat.,rock-polish
398,poison jab,Poison, Physical,20,80,The target is stabbed with a tentacle  an arm  or the like steeped in poison. This may also poison the target.,poison-jab
399,dark pulse,Dark, Special,15,80,The user releases a horrible aura imbued with ill intent. This may also make the target flinch.,dark-pulse
400,night slash,Dark, Physical,15,70,The user slashes the target the instant an opportunity arises. This move has a heightened chance of landing a critical hit.,night-slash
401,aqua tail,Water, Physical,10,90,The user attacks by swinging its tail as if it were a vicious wave in a raging storm.,aqua-tail
402,seed bomb,Grass, Physical,15,80,The user attacks by slamming a barrage of hard-shelled seeds down on the target from above.,seed-bomb
403,air slash,Flying, Special,15,75,The user attacks with a blade of air that slices even the sky. This may also make the target flinch.,air-slash
404,x-scissor,Bug, Physical,15,80,The user slashes at the target by crossing its scythes  claws  or the like as if they were a pair of scissors.,x-scissor
405,bug buzz,Bug, Special,10,90,The user vibrates to generate a damaging sound wave. This may also lower the target's Sp. Def stat.,bug-buzz
406,dragon pulse,Dragon, Special,10,85,The target is attacked with a shock wave generated by the user's gaping mouth.,dragon-pulse
407,dragon rush,Dragon, Physical,10,100,The user tackles the target while exhibiting overwhelming menace. This may also make the target flinch.,dragon-rush
408,power gem,Rock, Special,20,80,The user attacks with a ray of light that sparkles as if it were made of gemstones.,power-gem
409,drain punch,Fighting, Physical,10,75,The user attacks with an energy-draining punch. The user's HP is restored by up to half the damage taken by the target.,drain-punch
410,vacuum wave,Fighting, Special,30,40,The user whirls its fists to send a wave of pure vacuum at the target. This move always goes first.,vacuum-wave
411,focus blast,Fighting, Special,5,120,The user heightens its mental focus and unleashes its power. This may also lower the target's Sp. Def stat.,focus-blast
412,energy ball,Grass, Special,10,90,The user draws power from nature and fires it at the target. This may also lower the target's Sp. Def stat.,energy-ball
413,brave bird,Flying, Physical,15,120,The user tucks in its wings and charges at a low altitude. This also damages the user quite a lot.,brave-bird
414,earth power,Ground, Special,10,90,The user makes the ground under the target erupt with power. This may also lower the target's Sp. Def stat.,earth-power
415,switcheroo,Dark, Status,10,0,The user trades held items with the target faster than the eye can follow.,switcheroo
416,giga impact,Normal, Physical,5,150,The user charges at the target using every bit of its power. The user can't move on the next turn.,giga-impact
417,nasty plot,Dark, Status,20,0,The user stimulates its brain by thinking bad thoughts. This sharply boosts the user's Sp. Atk stat.,nasty-plot
418,bullet punch,Steel, Physical,30,40,The user strikes the target with tough punches as fast as bullets. This move always goes first.,bullet-punch
419,avalanche,Ice, Physical,10,60,This move's power is doubled if the target has inflicted damage on the user in the same turn.,avalanche
420,ice shard,Ice, Physical,30,40,The user flash-freezes chunks of ice and hurls them at the target. This move always goes first.,ice-shard
421,shadow claw,Ghost, Physical,15,70,The user attacks by slashing the target with a sharp claw made from shadows. This move has a heightened chance of landing a critical hit.,shadow-claw
422,thunder fang,Electric, Physical,15,65,The user bites with electrified fangs. This may also make the target flinch or leave it with paralysis.,thunder-fang
423,ice fang,Ice, Physical,15,65,The user bites with cold-infused fangs. This may also make the target flinch or leave it frozen.,ice-fang
424,fire fang,Fire, Physical,15,65,The user bites with flame-cloaked fangs. This may also make the target flinch or leave it with a burn.,fire-fang
425,shadow sneak,Ghost, Physical,30,40,The user extends its shadow and attacks the target from behind. This move always goes first.,shadow-sneak
426,mud bomb,Ground, Special,10,65,This move can’t be used.It’s recommended that this move is forgotten. Once forgotten  this move can’t be remembered,mud-bomb
427,psycho cut,Psychic, Physical,20,70,The user tears at the target with blades formed by psychic power. This move has a heightened chance of landing a critical hit.,psycho-cut
428,zen headbutt,Psychic, Physical,15,80,The user focuses its willpower to its head and attacks the target. This may also make the target flinch.,zen-headbutt
429,mirror shot,Steel, Special,10,65,This move can’t be used.It’s recommended that this move is forgotten. Once forgotten  this move can’t be remembered,mirror-shot
430,flash cannon,Steel, Special,10,80,The user gathers all its light energy and releases it at once. This may also lower the target's Sp. Def stat.,flash-cannon
431,rock climb,Normal, Physical,20,90,This move can’t be used.It’s recommended that this move is forgotten. Once forgotten  this move can’t be remembered,rock-climb
432,defog,Flying, Status,15,0,A strong wind blows away the target's barriers such as Reflect or Light Screen. This also lowers the target's evasiveness.,defog
433,trick room,Psychic, Status,5,0,The user creates a bizarre area in which slower Pokémon get to move first for five turns.,trick-room
434,draco meteor,Dragon, Special,5,130,Comets are summoned down from the sky onto the target. The recoil from this move harshly lowers the user’s Sp. Atk stat.,draco-meteor
435,discharge,Electric, Special,15,80,The user strikes everything around it by letting loose a flare of electricity. This may also leave those hit by the attack with paralysis.,discharge
436,laa plume,Fire, Special,15,80,The user torches everything around it in an inferno of scarlet flames. This may also leave those it hits with a burn.,laa-plume
437,leaf storm,Grass, Special,5,130,The user whips up a storm of leaves around the target. The recoil from this move harshly lowers the user's Sp. Atk stat.,leaf-storm
438,power whip,Grass, Physical,10,120,The user violently whirls its vines  tentacles  or the like to lash the target.,power-whip
439,rock wrecker,Rock, Physical,5,150,The user launches a huge boulder at the target to attack. The user can't move on the next turn.,rock-wrecker
440,cross poison,Poison, Physical,20,70,A slashing attack with a poisonous blade that may also poison the target. This move has a heightened chance of landing a critical hit.,cross-poison
441,gunk shot,Poison, Physical,5,120,The user shoots filthy garbage at the target to attack. This may also poison the target.,gunk-shot
442,iron head,Steel, Physical,15,80,The user slams the target with its steel-hard head. This may also make the target flinch.,iron-head
443,magnet bomb,Steel, Physical,20,60,This move can’t be used.It’s recommended that this move is forgotten. Once forgotten  this move can’t be remembered,magnet-bomb
444,stone edge,Rock, Physical,5,100,The user stabs the target with sharpened stones. This move has a heightened chance of landing a critical hit.,stone-edge
445,captiate,Normal, Status,20,0,This move can’t be used.It’s recommended that this move is forgotten. Once forgotten  this move can’t be remembered.,captiate
446,stealth rock,Rock, Status,20,0,The user lays a trap of levitating stones around the opposing team. The trap damages opposing Pokémon that switch into battle.,stealth-rock
447,grass knot,Grass, Special,20,0,The user snares the target with grass and trips it. The heavier the target  the greater the move's power.,grass-knot
448,chatter,Flying, Special,20,65,The user attacks the target with sound waves ofdeafening chatter. This confuses the target.,chatter
449,judgment,Normal, Special,10,100,The user releases countless shots of light at the target. This move's type changes depending on the kind of plate held by the user.,judgment
450,bug bite,Bug, Physical,20,60,The user attacks by biting the target. If the target is holding a Berry  the user eats it and gains its effect.,bug-bite
451,charge beam,Electric, Special,10,50,The user attacks the target with an electric charge. The residual electricity may also boost the user's Sp. Atk stat.,charge-beam
452,wood hammer,Grass, Physical,15,120,The user slams its rugged body into the target to attack. This also damages the user quite a lot.,wood-hammer
453,aqua jet,Water, Physical,20,40,The user lunges at the target to inflict damage  moving at blinding speed. This move always goes first.,aqua-jet
454,attack order,Bug, Physical,15,90,The user calls out its underlings to pummel the target. This move has a heightened chance of landing a critical hit.,attack-order
455,defend order,Bug, Status,10,0,The user calls out its underlings to shield its body  boosting its Defense and Sp. Def stats.,defend-order
456,heal order,Bug, Status,10,0,This move can’t be used.It’s recommended that this move is forgotten. Once forgotten  this move can’t be remembered,heal-order
457,head smash,Rock, Physical,5,150,The user attacks the target with a hazardous full-power headbutt. This also damages the user terribly.,head-smash
458,double hit,Normal, Physical,10,35,The user slams the target with a tail or the like. The target is hit twice in a row.,double-hit
459,roar of time,Dragon, Special,5,150,The user blasts the target with power that distorts even time. The user can't move on the next turn.,roar-of-time
460,spacial rend,Dragon, Special,5,100,The user tears the target along with the space around it. This move has a heightened chance of landing a critical hit.,spacial-rend
461,lunar dance,Psychic, Status,10,0,The user faints. In return  the Pokémon taking its place will have its HP and PP restored and its status conditions cured.,lunar-dance
462,crush grip,Normal, Physical,5,0,The target is crushed with great force. The more HP the target has left  the greater the move's power.,crush-grip
463,magma storm,Fire, Special,5,100,The user traps the target inside a maelstrom of fire that inflicts damage for four to five turns.,magma-storm
464,dark void,Dark, Status,10,0,Opposing Pokémon are dragged into a world of total darkness that puts them to sleep.,dark-void
465,seed flare,Grass, Special,5,120,The user emits a shock wave from its body to attack its target. This may also harshly lower the target's Sp. Def stat.,seed-flare
466,ominous wind,Ghost, Special,5,60,This move can’t be used.It’s recommended that this move is forgotten. Once forgotten  this move can’t be remembered,ominous-wind
467,shadow force,Ghost, Physical,5,120,The user disappears on the first turn  then attacks on the next turn. This move hits even if the target protects itself.,shadow-force
468,hone claws,Dark, Status,15,0,The user sharpens its claws to boost its Attack stat and accuracy.,hone-claws
469,wide guard,Rock, Status,10,0,The user and its allies are protected from wide-ranging attacks for one turn.,wide-guard
470,guard split,Psychic, Status,10,0,The user employs its psychic power to average its Defense and Sp. Def stats with those of the target.,guard-split
471,power split,Psychic, Status,10,0,The user employs its psychic power to average its Attack and Sp. Atk stats with those of the target.,power-split
472,wonder room,Psychic, Status,10,0,The user creates a bizarre area in which Pokémon's Defense and Sp. Def stats are swapped for five turns.,wonder-room
473,psyshock,Psychic, Special,10,80,The user materializes an odd psychic wave to attack the target. This move deals physical damage.,psyshock
474,venoshock,Poison, Special,10,65,The user drenches the target in a special poisonous liquid. This move's power is doubled if the target is poisoned.,venoshock
475,autotomize,Steel, Status,15,0,The user sheds part of its body to make itself lighterand sharply raise its Speed stat.,autotomize
476,rage powder,Bug, Status,20,0,The user scatters a cloud of irritating powder to draw attention to itself. Opposing Pokémon aim only at the user.,rage-powder
477,telekinesis,Psychic, Status,15,0,This move can’t be used.It’s recommended that this move is forgotten. Once forgotten  this move can’t be remembered,telekinesis
478,magic room,Psychic, Status,10,0,The user creates a bizarre area in which Pokémon's held items lose their effects for five turns.,magic-room
479,smack down,Rock, Physical,15,50,The user throws a stone or similar projectile to attack the target. If the target is in the air  it will be knocked down to the ground.,smack-down
480,storm throw,Fighting, Physical,10,60,The user strikes the target with a fierce blow. Thisattack always results in a critical hit.,storm-throw
481,flame burst,Fire, Special,15,70,This move can’t be used.It’s recommended that this move is forgotten. Once forgotten  this move can’t be remembered,flame-burst
482,sludge wave,Poison, Special,10,95,The user strikes everything around it by swamping the area with a giant sludge wave. This may also poison those it hits.,sludge-wave
483,quiver dance,Bug, Status,20,0,The user lightly performs a beautiful  mystic dance. This boosts the user's Sp. Atk  Sp. Def  and Speed stats.,quiver-dance
484,heavy slam,Steel, Physical,10,0,The user slams into the target with its heavy body. The more the user outweighs the target  the greater the move's power.,heavy-slam
485,synchronoise,Psychic, Special,10,120,This move can’t be used.It’s recommended that this move is forgotten. Once forgotten  this move can’t be remembered,synchronoise
486,electro ball,Electric, Special,10,0,The user hurls an electric orb at the target. The faster the user is than the target  the greater the move's power.,electro-ball
487,soak,Water, Status,20,0,The user shoots a torrent of water that changes the target's type to Water.,soak
488,flame charge,Fire, Physical,20,50,Cloaking itself in flame  the user attacks the target. Then  building up momentum  the user boosts its Speed stat.,flame-charge
489,coil,Poison, Status,20,0,The user coils up and concentrates. This boosts its Attack and Defense stats as well as its accuracy.,coil
490,low sweep,Fighting, Physical,20,65,The user makes a swift attack on the target's legs  which lowers the target's Speed stat.,low-sweep
491,acid spray,Poison, Special,20,40,The user attacks by spitting fluid that works to melt the target. This also harshly lowers the target's Sp. Def stat.,acid-spray
492,foul play,Dark, Physical,15,95,The user turns the target's strength against it. The higher the target's Attack stat  the greater the damage this move inflicts.,foul-play
493,simple beam,Normal, Status,15,0,The user emits a mysterious psychic wave that changes the target's Ability to Simple.,simple-beam
494,entrainment,Normal, Status,15,0,The user dances with an odd rhythm that compels the target to mimic it  making the target's Ability the same as the user's.,entrainment
495,after you,Normal, Status,15,0,The user helps the target and makes it use its move right after the user.,after-you
496,round,Normal, Special,15,60,The user attacks the target with a song. If others use this move  they will act immediately after the initial user  and the power of their Rounds will be boosted.,round
497,echoed voice,Normal, Special,15,40,The user attacks the target with an echoing voice. If this move is used consecutively by any Pokémon  its power is boosted.,echoed-voice
498,chip away,Normal, Physical,20,70,This move can’t be used.It’s recommended that this move is forgotten. Once forgotten  this move can’t be remembered,chip-away
499,clear smog,Poison, Special,15,50,The user attacks the target by throwing a clump of special mud. All stat changes are eliminated.,clear-smog
500,stored power,Psychic, Special,10,20,The user attacks the target with stored power. The more the user's stats are boosted  the greater the move's power.,stored-power
501,quick guard,Fighting, Status,15,0,The user protects itself and its allies from priority moves.,quick-guard
502,ally switch,Psychic, Status,15,0,The user teleports using a strange power and switches places with one of its allies. This move's chance of failing rises if it is used in succession.,ally-switch
503,scald,Water, Special,15,80,The user attacks by shooting boiling hot water at the target. This may also leave the target with a burn.,scald
504,shell smash,Normal, Status,15,0,The user breaks its shell  which lowers its Defense and Sp. Def stats but sharply boosts its Attack  Sp. Atk  and Speed stats.,shell-smash
505,heal pulse,Psychic, Status,10,0,The user emits a healing pulse that restores the target's HP by up to half its max HP.,heal-pulse
506,hex,Ghost, Special,10,65,This relentless attack does massive damage to a target affected by status conditions.,hex
507,sky drop,Flying, Physical,10,60,This move can’t be used.It’s recommended that this move is forgotten. Once forgotten  this move can’t be remembered,sky-drop
508,shift gear,Steel, Status,10,0,The user rotates its gears  boosting its Attack stat and sharply boosting its Speed stat.,shift-gear
509,circle throw,Fighting, Physical,10,60,The target is thrown  and a different Pokémon is dragged out. In the wild  this ends a battle against a single Pokémon.,circle-throw
510,incinerate,Fire, Special,15,60,The user attacks opposing Pokémon with fire. If a Pokémon is holding a certain item  such as a Berry  the item becomes burned up and unusable.,incinerate
511,quash,Dark, Status,15,0,The user suppresses the target and makes its move go last.,quash
512,acrobatics,Flying, Physical,15,55,The user nimbly strikes the target. This attack does massive damage if the user isn't holding an item.,acrobatics
513,reflect type,Normal, Status,15,0,The user reflects the target's type to become the same type as the target.,reflect-type
514,retaliate,Normal, Physical,5,70,The user takes revenge for a fainted ally. This move's power is boosted if an ally fainted in the previous turn.,retaliate
515,final gambit,Fighting, Special,5,0,The user risks everything to attack the target. The user faints but inflicts damage equal to its own HP.,final-gambit
516,bestow,Normal, Status,15,0,This move can’t be used.It’s recommended that this move is forgotten. Once forgotten  this move can’t be remembered,bestow
517,inferno,Fire, Special,5,100,The user attacks by engulfing the target in an intense fire. This leaves the target with a burn.,inferno
518,water pledge,Water, Special,10,80,A column of water hits the target. When used with its fire counterpart  this move's power is boosted and a rainbow appears.,water-pledge
519,fire pledge,Fire, Special,10,80,A column of fire hits the target. When used with its grass counterpart  this move's power is boosted and a vast sea of fire appears.,fire-pledge
520,grass pledge,Grass, Special,10,80,A column of grass hits the target. When used with its water counterpart  this move's power is boosted and a vast swamp appears.,grass-pledge
521,volt switch,Electric, Special,20,70,After making its attack  the user rushes back to switch places with a party Pokémon in waiting.,volt-switch
522,struggle bug,Bug, Special,20,50,The user attacks by struggling against opposing Pokémon. This also lowers their Sp. Atk stats.,struggle-bug
523,bulldoze,Ground, Physical,20,60,The user strikes everything around it by stomping down on the ground. This lowers the Speed stats of those hit.,bulldoze
524,frost breath,Ice, Special,10,60,The user attacks by blowing its cold breath on the target. This move always lands a critical hit.,frost-breath
525,dragon tail,Dragon, Physical,10,60,The target is knocked away  and a different Pokémon is dragged out. In the wild  this ends a battle against a single Pokémon.,dragon-tail
526,work up,Normal, Status,30,0,The user is roused  and its Attack and Sp. Atk stats are boosted.,work-up
527,electroweb,Electric, Special,15,55,The user captures opposing Pokémon in an electric net to inflict damage. This also lowers their Speed stats.,electroweb
528,wild charge,Electric, Physical,15,90,The user shrouds itself in electricity and smashes into its target. This also damages the user a little.,wild-charge
529,drill run,Ground, Physical,10,80,The user crashes into the target while rotating its body like a drill. This move has a heightened chance of landing a critical hit.,drill-run
530,dual chop,Dragon, Physical,15,40,The user attacks its target by hitting it with brutalstrikes. The target is hit twice in a row.,dual-chop
531,heart stamp,Psychic, Physical,25,60,This move can’t be used.It’s recommended that this move is forgotten. Once forgotten  this move can’t be remembered,heart-stamp
532,horn leech,Grass, Physical,10,75,The user drains the target's energy with its horns. The user's HP is restored by up to half the damage taken by the target.,horn-leech
533,sacred sword,Fighting, Physical,15,90,The user attacks by slicing with a sword. The target's stat changes don't affect the damage inflicted by this move.,sacred-sword
534,razor shell,Water, Physical,10,75,The user cuts the target with sharp shells to inflict damage. This may also lower the target's Defense stat.,razor-shell
535,heat crash,Fire, Physical,10,0,The user slams into the target with its flame-covered body. The more the user outweighs the target  the greater the move's power.,heat-crash
536,leaf tornado,Grass, Special,10,65,The user attacks its target by encircling it in sharpleaves. This attack may also lower thetarget’s accuracy.,leaf-tornado
537,steamroller,Bug, Physical,20,65,This move can’t be used.It’s recommended that this move is forgotten. Once forgotten  this move can’t be remembered,steamroller
538,cotton guard,Grass, Status,10,0,The user protects itself by wrapping its body in soft cotton  drastically boosting its Defense stat.,cotton-guard
539,night daze,Dark, Special,10,85,The user looses a pitch-black shock wave at the target to inflict damage. This may also lower the target's accuracy.,night-daze
540,psystrike,Psychic, Special,10,100,The user materializes an odd psychic wave to attack the target. This move deals physical damage.,psystrike
541,tail slap,Normal, Physical,10,25,The user attacks by striking the target with its hard tail. This move hits two to five times in a row.,tail-slap
542,hurricane,Flying, Special,10,110,The user attacks by wrapping its opponent in a fierce wind. This may also confuse the target.,hurricane
543,head charge,Normal, Physical,15,120,The user charges its head into its target  using itspowerful guard hair. This also damages the usera little.,head-charge
544,gear grind,Steel, Physical,15,50,The user attacks by throwing steel gears at itstarget twice.,gear-grind
545,searing shot,Fire, Special,5,100,The user torches everything around it in an infernoof scarlet flames. This may also leave those it hitswith a burn.,searing-shot
546,techno blast,Normal, Special,5,120,The user fires a beam of light at its target. Themove’s type changes depending on the Drive theuser holds.,techno-blast
547,relic song,Normal, Special,10,75,The user sings an ancient song and attacks by appealing to the hearts of the listening opposing Pokémon. This may also induce sleep.,relic-song
548,secret sword,Fighting, Special,10,85,The user cuts with its long horn. The odd power contained in the horn deals physical damage to the target.,secret-sword
549,glaciate,Ice, Special,10,65,The user attacks by blowing freezing cold air at opposing Pokémon. This also lowers their Speed stats.,glaciate
550,bolt strike,Electric, Physical,5,130,The user surrounds itself with a great amount of electricity and charges the target. This may also leave the target with paralysis.,bolt-strike
551,blue flare,Fire, Special,5,130,The user attacks by engulfing the target in an intense  yet beautiful  blue flame. This may also leave the target with a burn.,blue-flare
552,fiery dance,Fire, Special,10,80,Cloaked in flames  the user attacks the target by dancing and flapping its wings. This may also boost the user's Sp. Atk stat.,fiery-dance
553,freeze shock,Ice, Physical,5,140,The turn after using this move  the user hits the target with electrically charged ice to inflict damage. This may also leave the target with paralysis.,freeze-shock
554,ice burn,Ice, Special,5,140,The turn after using this move  the user surrounds the target with an ultracold  freezing wind to inflict damage. This may also leave the target with a burn.,ice-burn
555,snarl,Dark, Special,15,55,The user yells as if it's ranting about something  which lowers the Sp. Atk stats of opposing Pokémon.,snarl
